{
  "questions": {
    "q_reddit_1ij71tk": {
      "aliases": [],
      "collected_at": "2026-08-02T20:10:00+09:00",
      "content_hash": "8c847420788abf3ca602fac0699aa1fb365fbf75f404f3e99bedade1a06ed567",
      "created_at": "2025-02-06T00:00:00Z",
      "engagement": {
        "upvotes": 19.0
      },
      "evidence_type": "OBSERVED_QUESTION",
      "property_id": "",
      "question_id": "q_reddit_1ij71tk",
      "site": "korea_easy_guide",
      "source": "reddit",
      "source_item_id": "1ij71tk",
      "summary": "A traveler asks for the most reliable KTX booking route and whether a foreign Mastercard will work.",
      "title": "KTX train tickets to Busan as a foreigner",
      "topic_id": "topic_1163490f536ca05f61",
      "url": "https://www.reddit.com/r/koreatravel/comments/1ij71tk/ktx_train_tickets_to_busan_as_a_foreigner",
      "verification_method": "browser_verified",
      "verified_at": "2026-08-02T20:10:00+09:00",
      "verified_by": "codex"
    },
    "q_sc_korea_airport_limousine_bus_seoul": {
      "aliases": [],
      "collected_at": "2026-08-02T20:10:00+09:00",
      "content_hash": "5b457b53e4f490a028ed6dabaec1caa064c8bd1b59038e44bb36ee8885930529",
      "created_at": "2025-08-02T00:00:00+09:00",
      "engagement": {
        "clicks": 0.0,
        "ctr": 0.0,
        "impressions": 1.0,
        "position": 26.0
      },
      "evidence_type": "FIRST_PARTY_QUERY",
      "property_id": "https://koreaeasyguide.blogspot.com/",
      "question_id": "q_sc_korea_airport_limousine_bus_seoul",
      "site": "korea_easy_guide",
      "source": "google_search_console",
      "source_item_id": "sc-korea-20250729-20260729-airport-limousine-bus-seoul",
      "summary": "Authorized Search Console query in the 2025-08-02 through 2026-08-02 window: 1 impressions, 0 clicks, average position 26.",
      "title": "airport limousine bus seoul",
      "topic_id": "topic_32fd1155c0c7f0f0ad",
      "url": "",
      "verification_method": "search_console_api",
      "verified_at": "2026-08-02T20:10:00+09:00",
      "verified_by": "codex"
    },
    "q_sc_korea_arex_all_stop_train": {
      "aliases": [],
      "collected_at": "2026-08-02T20:10:00+09:00",
      "content_hash": "e990db75b42be2f8a7d907565b8fae7dbcb9f3a1fa0d35cd4d00bef18bf8605c",
      "created_at": "2025-08-02T00:00:00+09:00",
      "engagement": {
        "clicks": 0.0,
        "ctr": 0.0,
        "impressions": 1.0,
        "position": 41.0
      },
      "evidence_type": "FIRST_PARTY_QUERY",
      "property_id": "https://koreaeasyguide.blogspot.com/",
      "question_id": "q_sc_korea_arex_all_stop_train",
      "site": "korea_easy_guide",
      "source": "google_search_console",
      "source_item_id": "sc-korea-20250729-20260729-arex-all-stop-train",
      "summary": "Authorized Search Console query in the 2025-08-02 through 2026-08-02 window: 1 impressions, 0 clicks, average position 41.",
      "title": "arex all stop train",
      "topic_id": "topic_b3c9abb6252364c13b",
      "url": "",
      "verification_method": "search_console_api",
      "verified_at": "2026-08-02T20:10:00+09:00",
      "verified_by": "codex"
    },
    "q_sc_korea_bus_ticket": {
      "aliases": [],
      "collected_at": "2026-08-02T20:10:00+09:00",
      "content_hash": "7129d58c3b54325f2f798ae6d9cdfeec2a3f2c03b331f118c856b26895550f02",
      "created_at": "2025-08-02T00:00:00+09:00",
      "engagement": {
        "clicks": 0.0,
        "ctr": 0.0,
        "impressions": 4.0,
        "position": 28.25
      },
      "evidence_type": "FIRST_PARTY_QUERY",
      "property_id": "https://koreaeasyguide.blogspot.com/",
      "question_id": "q_sc_korea_bus_ticket",
      "site": "korea_easy_guide",
      "source": "google_search_console",
      "source_item_id": "sc-korea-20250729-20260729-korea-bus-ticket",
      "summary": "Authorized Search Console query in the 2025-08-02 through 2026-08-02 window: 4 impressions, 0 clicks, average position 28.25.",
      "title": "korea bus ticket",
      "topic_id": "topic_1ce783e0d6e245355a",
      "url": "",
      "verification_method": "search_console_api",
      "verified_at": "2026-08-02T20:10:00+09:00",
      "verified_by": "codex"
    },
    "q_sc_korea_bus_tickets": {
      "aliases": [],
      "collected_at": "2026-08-02T20:10:00+09:00",
      "content_hash": "309027f2d1392b8ce0c3cdcc8ed8ecb4416224d41f24418c505713319d8e29f4",
      "created_at": "2025-08-02T00:00:00+09:00",
      "engagement": {
        "clicks": 0.0,
        "ctr": 0.0,
        "impressions": 1.0,
        "position": 29.0
      },
      "evidence_type": "FIRST_PARTY_QUERY",
      "property_id": "https://koreaeasyguide.blogspot.com/",
      "question_id": "q_sc_korea_bus_tickets",
      "site": "korea_easy_guide",
      "source": "google_search_console",
      "source_item_id": "sc-korea-20250729-20260729-korea-bus-tickets",
      "summary": "Authorized Search Console query in the 2025-08-02 through 2026-08-02 window: 1 impressions, 0 clicks, average position 29.",
      "title": "korea bus tickets",
      "topic_id": "topic_1ce783e0d6e245355a",
      "url": "",
      "verification_method": "search_console_api",
      "verified_at": "2026-08-02T20:10:00+09:00",
      "verified_by": "codex"
    },
    "q_sc_korea_how_to_charge_tmoney_card": {
      "aliases": [],
      "collected_at": "2026-08-02T20:10:00+09:00",
      "content_hash": "9010307dff180890818163faba23318a55080203a45f2577ff3e2c549191906b",
      "created_at": "2025-08-02T00:00:00+09:00",
      "engagement": {
        "clicks": 0.0,
        "ctr": 0.0,
        "impressions": 1.0,
        "position": 19.0
      },
      "evidence_type": "FIRST_PARTY_QUERY",
      "property_id": "https://koreaeasyguide.blogspot.com/",
      "question_id": "q_sc_korea_how_to_charge_tmoney_card",
      "site": "korea_easy_guide",
      "source": "google_search_console",
      "source_item_id": "sc-korea-20250729-20260729-how-to-charge-tmoney-card",
      "summary": "Authorized Search Console query in the 2025-08-02 through 2026-08-02 window: 1 impressions, 0 clicks, average position 19.",
      "title": "how to charge tmoney card",
      "topic_id": "topic_4633cea98ef2dc5eaf",
      "url": "",
      "verification_method": "search_console_api",
      "verified_at": "2026-08-02T20:10:00+09:00",
      "verified_by": "codex"
    },
    "q_sc_korea_how_to_top_up_tmoney_card": {
      "aliases": [],
      "collected_at": "2026-08-02T20:10:00+09:00",
      "content_hash": "62397f10d73c1244aecd6fb8380ffeb5f031aee3326cb0864dc102cbc9241931",
      "created_at": "2025-08-02T00:00:00+09:00",
      "engagement": {
        "clicks": 0.0,
        "ctr": 0.0,
        "impressions": 1.0,
        "position": 18.0
      },
      "evidence_type": "FIRST_PARTY_QUERY",
      "property_id": "https://koreaeasyguide.blogspot.com/",
      "question_id": "q_sc_korea_how_to_top_up_tmoney_card",
      "site": "korea_easy_guide",
      "source": "google_search_console",
      "source_item_id": "sc-korea-20250729-20260729-how-to-top-up-tmoney-card",
      "summary": "Authorized Search Console query in the 2025-08-02 through 2026-08-02 window: 1 impressions, 0 clicks, average position 18.",
      "title": "how to top up t-money card",
      "topic_id": "topic_4633cea98ef2dc5eaf",
      "url": "",
      "verification_method": "search_console_api",
      "verified_at": "2026-08-02T20:10:00+09:00",
      "verified_by": "codex"
    },
    "q_sc_korea_icn_airport_to_seoul_station": {
      "aliases": [],
      "collected_at": "2026-08-02T20:10:00+09:00",
      "content_hash": "9fcbafc1def4958ef13d9ccdebb79bdc20a0b68639549f4ab15d08907fb1361c",
      "created_at": "2025-08-02T00:00:00+09:00",
      "engagement": {
        "clicks": 0.0,
        "ctr": 0.0,
        "impressions": 1.0,
        "position": 71.0
      },
      "evidence_type": "FIRST_PARTY_QUERY",
      "property_id": "https://koreaeasyguide.blogspot.com/",
      "question_id": "q_sc_korea_icn_airport_to_seoul_station",
      "site": "korea_easy_guide",
      "source": "google_search_console",
      "source_item_id": "sc-korea-20250729-20260729-icn-airport-to-seoul-station",
      "summary": "Authorized Search Console query in the 2025-08-02 through 2026-08-02 window: 1 impressions, 0 clicks, average position 71.",
      "title": "icn airport to seoul station",
      "topic_id": "topic_405d908d82465e2077",
      "url": "",
      "verification_method": "search_console_api",
      "verified_at": "2026-08-02T20:10:00+09:00",
      "verified_by": "codex"
    },
    "q_sc_korea_incheon_limousine_bus": {
      "aliases": [],
      "collected_at": "2026-08-02T20:10:00+09:00",
      "content_hash": "beeb26b14a35db4baa3308e3e0fe086f4750dd3279acb01b4f7c4bd4623c2c8f",
      "created_at": "2025-08-02T00:00:00+09:00",
      "engagement": {
        "clicks": 0.0,
        "ctr": 0.0,
        "impressions": 1.0,
        "position": 26.0
      },
      "evidence_type": "FIRST_PARTY_QUERY",
      "property_id": "https://koreaeasyguide.blogspot.com/",
      "question_id": "q_sc_korea_incheon_limousine_bus",
      "site": "korea_easy_guide",
      "source": "google_search_console",
      "source_item_id": "sc-korea-20250729-20260729-incheon-limousine-bus",
      "summary": "Authorized Search Console query in the 2025-08-02 through 2026-08-02 window: 1 impressions, 0 clicks, average position 26.",
      "title": "incheon limousine bus",
      "topic_id": "topic_32fd1155c0c7f0f0ad",
      "url": "",
      "verification_method": "search_console_api",
      "verified_at": "2026-08-02T20:10:00+09:00",
      "verified_by": "codex"
    },
    "q_sc_korea_incheon_to_seoul": {
      "aliases": [],
      "collected_at": "2026-08-02T20:10:00+09:00",
      "content_hash": "7655d69888239c3a30713e3a4c9062de82f26c03920ee157bf49f30c02e813a0",
      "created_at": "2025-08-02T00:00:00+09:00",
      "engagement": {
        "clicks": 0.0,
        "ctr": 0.0,
        "impressions": 1.0,
        "position": 69.0
      },